{
  "$id": "https://commandlayer.org/schemas/v1.1.0/commercial/verify/verify.receipt.schema.json",
  "$schema": "https://json-schema.org/draft/2020-12/schema",
  "title": "verify.receipt",
  "description": "Canonical verification outcome artifact.",
  "type": "object",
  "additionalProperties": false,
  "$defs": {
    "actor_identity": {
      "type": "object",
      "additionalProperties": false,
      "required": [
        "role",
        "id"
      ],
      "properties": {
        "role": {
          "type": "string",
          "enum": [
            "payer",
            "payee",
            "merchant",
            "provider",
            "carrier",
            "verifier"
          ]
        },
        "id": {
          "type": "string",
          "minLength": 1,
          "maxLength": 128
        },
        "kind": {
          "type": "string",
          "enum": [
            "agent",
            "organization",
            "wallet",
            "account",
            "service",
            "human"
          ]
        },
        "display_name": {
          "type": "string",
          "maxLength": 128
        },
        "uri": {
          "type": "string",
          "format": "uri",
          "maxLength": 512
        }
      }
    },
    "payer_actor": {
      "allOf": [
        {
          "$ref": "#/$defs/actor_identity"
        },
        {
          "type": "object",
          "properties": {
            "role": {
              "const": "payer"
            }
          },
          "required": [
            "role"
          ]
        }
      ]
    },
    "payee_actor": {
      "allOf": [
        {
          "$ref": "#/$defs/actor_identity"
        },
        {
          "type": "object",
          "properties": {
            "role": {
              "const": "payee"
            }
          },
          "required": [
            "role"
          ]
        }
      ]
    },
    "merchant_actor": {
      "allOf": [
        {
          "$ref": "#/$defs/actor_identity"
        },
        {
          "type": "object",
          "properties": {
            "role": {
              "const": "merchant"
            }
          },
          "required": [
            "role"
          ]
        }
      ]
    },
    "provider_actor": {
      "allOf": [
        {
          "$ref": "#/$defs/actor_identity"
        },
        {
          "type": "object",
          "properties": {
            "role": {
              "const": "provider"
            }
          },
          "required": [
            "role"
          ]
        }
      ]
    },
    "carrier_actor": {
      "allOf": [
        {
          "$ref": "#/$defs/actor_identity"
        },
        {
          "type": "object",
          "properties": {
            "role": {
              "const": "carrier"
            }
          },
          "required": [
            "role"
          ]
        }
      ]
    },
    "verifier_actor": {
      "allOf": [
        {
          "$ref": "#/$defs/actor_identity"
        },
        {
          "type": "object",
          "properties": {
            "role": {
              "const": "verifier"
            }
          },
          "required": [
            "role"
          ]
        }
      ]
    },
    "reference": {
      "type": "object",
      "additionalProperties": false,
      "required": [
        "type",
        "id"
      ],
      "properties": {
        "type": {
          "type": "string",
          "enum": [
            "order",
            "invoice",
            "authorization",
            "checkout",
            "purchase",
            "fulfillment",
            "shipment",
            "payment",
            "settlement",
            "receipt",
            "payment_requirement",
            "payment_session",
            "payment_proof",
            "agent_card"
          ]
        },
        "id": {
          "type": "string",
          "minLength": 1,
          "maxLength": 128
        },
        "uri": {
          "type": "string",
          "format": "uri",
          "maxLength": 512
        }
      }
    }
  },
  "properties": {
    "protocol": {
      "type": "string",
      "const": "commercial"
    },
    "version": {
      "type": "string",
      "const": "1.1.0"
    },
    "verb": {
      "type": "string",
      "const": "verify"
    },
    "receipt_id": {
      "type": "string",
      "minLength": 1,
      "maxLength": 128
    },
    "issued_at": {
      "type": "string",
      "format": "date-time"
    },
    "request_id": {
      "type": "string",
      "minLength": 1,
      "maxLength": 128
    },
    "status": {
      "type": "string",
      "enum": [
        "verified",
        "not_verified",
        "inconclusive"
      ]
    },
    "verifier": {
      "allOf": [
        {
          "$ref": "#/$defs/actor_identity"
        },
        {
          "type": "object",
          "properties": {
            "role": {
              "const": "verifier"
            }
          },
          "required": [
            "role"
          ]
        }
      ]
    },
    "target_type": {
      "type": "string",
      "enum": [
        "receipt",
        "payment_proof",
        "settlement",
        "shipment",
        "authorization",
        "fulfillment"
      ]
    },
    "target_ref": {
      "$ref": "#/$defs/reference"
    },
    "evidence_refs": {
      "type": "array",
      "minItems": 1,
      "maxItems": 8,
      "items": {
        "$ref": "#/$defs/reference"
      }
    },
    "basis": {
      "type": "string",
      "minLength": 1,
      "maxLength": 512
    },
    "reason": {
      "type": "string",
      "maxLength": 512
    }
  },
  "required": [
    "protocol",
    "version",
    "verb",
    "receipt_id",
    "issued_at",
    "request_id",
    "status",
    "verifier",
    "target_type",
    "target_ref",
    "evidence_refs",
    "basis"
  ],
  "allOf": [
    {
      "if": {
        "properties": {
          "status": {
            "enum": [
              "not_verified",
              "inconclusive"
            ]
          }
        }
      },
      "then": {
        "properties": {
          "reason": {
            "type": "string",
            "maxLength": 512
          }
        },
        "required": [
          "reason"
        ]
      }
    }
  ]
}
