{
  "protocol": "commercial",
  "version": "1.1.0",
  "verb": "verify",
  "receipt_id": "verifyrcpt-001",
  "issued_at": "2026-03-19T10:20:02Z",
  "request_id": "verifyreq-001",
  "status": "verified",
  "verifier": {
    "role": "verifier",
    "id": "ledger.example",
    "kind": "service"
  },
  "target_type": "settlement",
  "target_ref": {
    "type": "settlement",
    "id": "settle-2001"
  },
  "evidence_refs": [
    {
      "type": "payment_proof",
      "id": "proof-2001",
      "uri": "https://merchant.example/x402/proofs/proof-2001"
    }
  ],
  "basis": "Matched canonical x402 settlement proof and merchant ledger entry."
}
